{"access_plane":{"access_plane_owner":"abyss-stack","authority_owner":"aoa-memo","name":"aoa_memo","runtime_status":"not_asserted_by_workspace_map","service_source_hint":"~/src/abyss-stack/mcp/services/aoa-memo-mcp","smoke_check":"python scripts/smoke_aoa_memo_mcp.py --workspace-root <workspace-root>","status":"registered"},"generated_by":"scripts/build_workspace_memory_map.py","owner_repo":"8Dionysus","places":[{"checkout_requirement":"required","checkout_state":"scanned","current_port_level":"route_only","evidence_route":".aoa:retrieve/rehydrate/review-packet","issues":[],"kind":"public-route-map","mcp":{"access_plane_owner":"abyss-stack","authority_owner":"aoa-memo","name":"aoa_memo","runtime_status":"not_asserted_by_workspace_map","service_source_hint":"~/src/abyss-stack/mcp/services/aoa-memo-mcp","smoke_check":"python scripts/smoke_aoa_memo_mcp.py --workspace-root <workspace-root>","status":"registered"},"memo_port":{"allowed_routes":[],"blocked_exports":0,"default_mode":"","index_present":false,"landed_exports":0,"local_candidates":0,"local_records":0,"missing_dirs":["candidates","receipts","exports","local"],"missing_files":["AGENTS.md","README.md","PORT.yaml"],"owner":"","path_hint":"","pending_candidates":0,"pending_exports":0,"port_level":"none","port_scope":"","present":false,"privacy_posture":"","ready_exports":0,"schema":"","stronger_memory_owner":"","total_exports":0,"validation_receipts":0},"memory_role":"workspace-route-map-owner","memory_route_status":"root_memory_route","name":"8Dionysus","path_hint":"8Dionysus","place_kind":"workspace-repo","recommended_port_level":"route_only","refactor_state":"pending-deep-refactor","reviewed_memory_route":"aoa-memo:reviewed-intake","role":"public routing, glossary alignment, profile-level orientation, and selected shared-root install surfaces","root_agents_present":true,"validation_command":"python scripts/build_workspace_memory_map.py --check","writeback_debt":{"basis":"checked-in map stores the stable marker route; git currentness is live-derived","live_command":"python scripts/build_workspace_memory_map.py --workspace-root <workspace-root> --writeback-debt-json","next_route":"run live writeback debt check before closeout","status":"live_check_required"},"writeback_marker":{"decision":"no_writeback_needed","marker_kind":"workspace_memory_map_sync","marker_path":"generated/workspace_memory_map.min.json","marker_ref":"8Dionysus/generated/workspace_memory_map.min.json","source":"workspace_memory_map_sync","status":"present"}},{"checkout_requirement":"required","checkout_state":"scanned","current_port_level":"full_port","evidence_route":".aoa:retrieve/rehydrate/review-packet","issues":[],"kind":"constitutional-center","mcp":{"access_plane_owner":"abyss-stack","authority_owner":"aoa-memo","name":"aoa_memo","runtime_status":"not_asserted_by_workspace_map","service_source_hint":"~/src/abyss-stack/mcp/services/aoa-memo-mcp","smoke_check":"python scripts/smoke_aoa_memo_mcp.py --workspace-root <workspace-root>","status":"registered"},"memo_port":{"allowed_routes":["local_only","reviewed_intake","owner_handoff","quarantine"],"blocked_exports":0,"default_mode":"write_candidate_only","index_present":true,"landed_exports":0,"local_candidates":0,"local_records":0,"missing_dirs":[],"missing_files":[],"owner":"Agents-of-Abyss","path_hint":"Agents-of-Abyss/memo","pending_candidates":0,"pending_exports":0,"port_level":"full_port","port_scope":"ecosystem","present":true,"privacy_posture":"public-center-safe","ready_exports":0,"schema":"aoa_local_memo_port_v1","stronger_memory_owner":"aoa-memo","total_exports":0,"validation_receipts":0},"memory_role":"local-memory-port-candidate","memory_route_status":"local_port_route","name":"Agents-of-Abyss","path_hint":"Agents-of-Abyss","place_kind":"workspace-repo","recommended_port_level":"full_port","refactor_state":"reference-topology","reviewed_memory_route":"aoa-memo:reviewed-intake","role":"ecosystem identity, charter, layer map, federation rules, and program-level direction","root_agents_present":true,"validation_command":"PYTHONPATH=\"${AOA_ABYSS_STACK_ROOT:-$HOME/src/abyss-stack}/mcp/services/aoa-memo-mcp/src\" python -m aoa_memo_mcp.cli validate-port --repo Agents-of-Abyss","writeback_debt":{"basis":"memory route exists but no first writeback marker source was found; this is first-marker activation backlog, not evidence of post-marker debt","first_marker_route":"local_memo_port_activation","live_command":"python scripts/build_workspace_memory_map.py --workspace-root <workspace-root> --writeback-debt-json","next_route":"inspect the owner repo and local memo port; record a bounded candidate/export only for meaningful landed work, otherwise record an explicit no-writeback marker","status":"needs_first_marker"},"writeback_marker":{"decision":"","marker_kind":"","marker_path":"","marker_ref":"","source":"","status":"missing"}},{"checkout_requirement":"required","checkout_state":"scanned","current_port_level":"full_port","evidence_route":".aoa:retrieve/rehydrate/review-packet","issues":["missing root Memory route"],"kind":"knowledge-root","mcp":{"access_plane_owner":"abyss-stack","authority_owner":"aoa-memo","name":"aoa_memo","runtime_status":"not_asserted_by_workspace_map","service_source_hint":"~/src/abyss-stack/mcp/services/aoa-memo-mcp","smoke_check":"python scripts/smoke_aoa_memo_mcp.py --workspace-root <workspace-root>","status":"registered"},"memo_port":{"allowed_routes":["local_only","reviewed_intake","owner_handoff","quarantine"],"blocked_exports":0,"default_mode":"write_candidate_only","index_present":true,"landed_exports":0,"local_candidates":0,"local_records":0,"missing_dirs":[],"missing_files":[],"owner":"Tree-of-Sophia","path_hint":"Tree-of-Sophia/memo","pending_candidates":0,"pending_exports":0,"port_level":"full_port","port_scope":"project","present":true,"privacy_posture":"public-tree-safe","ready_exports":0,"schema":"aoa_local_memo_port_v1","stronger_memory_owner":"aoa-memo","total_exports":0,"validation_receipts":0},"memory_role":"local-memory-port-candidate","memory_route_status":"missing","name":"Tree-of-Sophia","path_hint":"Tree-of-Sophia","place_kind":"workspace-repo","recommended_port_level":"full_port","refactor_state":"pending-deep-refactor","reviewed_memory_route":"aoa-memo:reviewed-intake","role":"source-linked knowledge, texts, concepts, lineages, and interpretive architecture","root_agents_present":true,"validation_command":"PYTHONPATH=\"${AOA_ABYSS_STACK_ROOT:-$HOME/src/abyss-stack}/mcp/services/aoa-memo-mcp/src\" python -m aoa_memo_mcp.cli validate-port --repo Tree-of-Sophia","writeback_debt":{"basis":"memory route exists but no first writeback marker source was found; this is first-marker activation backlog, not evidence of post-marker debt","first_marker_route":"local_memo_port_activation","live_command":"python scripts/build_workspace_memory_map.py --workspace-root <workspace-root> --writeback-debt-json","next_route":"inspect the owner repo and local memo port; record a bounded candidate/export only for meaningful landed work, otherwise record an explicit no-writeback marker","status":"needs_first_marker"},"writeback_marker":{"decision":"","marker_kind":"","marker_path":"","marker_ref":"","source":"","status":"missing"}},{"checkout_requirement":"required","checkout_state":"scanned","current_port_level":"full_port","evidence_route":".aoa:retrieve/rehydrate/review-packet","issues":[],"kind":"runtime-infrastructure","mcp":{"access_plane_owner":"abyss-stack","authority_owner":"aoa-memo","name":"aoa_memo","runtime_status":"not_asserted_by_workspace_map","service_source_hint":"~/src/abyss-stack/mcp/services/aoa-memo-mcp","smoke_check":"python scripts/smoke_aoa_memo_mcp.py --workspace-root <workspace-root>","status":"registered"},"memo_port":{"allowed_routes":["local_only","reviewed_intake","owner_handoff","quarantine"],"blocked_exports":1,"default_mode":"write_candidate_only","index_present":true,"landed_exports":3,"local_candidates":4,"local_records":0,"missing_dirs":[],"missing_files":[],"owner":"abyss-stack","path_hint":"~/src/abyss-stack/memo","pending_candidates":4,"pending_exports":1,"port_level":"full_port","port_scope":"repo","present":true,"privacy_posture":"public-source-runtime-safe","ready_exports":0,"schema":"aoa_local_memo_port_v1","stronger_memory_owner":"aoa-memo","total_exports":4,"validation_receipts":5},"memory_role":"mcp-access-plane-owner","memory_route_status":"local_port_route","name":"abyss-stack","path_hint":"~/src/abyss-stack","place_kind":"workspace-repo","recommended_port_level":"full_port","refactor_state":"pilot-access-plane","reviewed_memory_route":"aoa-memo:reviewed-intake","role":"runtime, deployment, storage, lifecycle services, and infrastructure posture","root_agents_present":true,"validation_command":"PYTHONPATH=\"${AOA_ABYSS_STACK_ROOT:-$HOME/src/abyss-stack}/mcp/services/aoa-memo-mcp/src\" python -m aoa_memo_mcp.cli validate-port --repo abyss-stack","writeback_debt":{"basis":"checked-in map stores the stable marker route; git currentness is live-derived","live_command":"python scripts/build_workspace_memory_map.py --workspace-root <workspace-root> --writeback-debt-json","next_route":"run live writeback debt check before closeout","status":"live_check_required"},"writeback_marker":{"decision":"write_candidate","marker_kind":"local_memo_receipt","marker_path":"memo/receipts/20260526T021627Z.export-abyss-stack-20260526t021621z-aoa-memo-mcp.forwarding-receipt.json","marker_ref":"~/src/abyss-stack/memo/receipts/20260526T021627Z.export-abyss-stack-20260526t021621z-aoa-memo-mcp.forwarding-receipt.json","source":"memo_port_packet","status":"present"}},{"checkout_requirement":"required","checkout_state":"scanned","current_port_level":"none","evidence_route":".aoa:retrieve/rehydrate/review-packet","issues":["missing root Memory route","recommended full memo port not yet present"],"kind":"host-machine-organ","mcp":{"access_plane_owner":"abyss-stack","authority_owner":"aoa-me